UniqueID,Bibliographical_reference,Source,Abstract_retrieved,Screening_decision,Fulltext_retrieved,Notes_fulltext_retrieved_status,Eligibility_decision,Notes_eligibility_decision,Quantitative_MA_Decision,Notes_quantitative_MA_Decision,Title,URL,Description,Details,ShortDetails,Resource,Type,Identifiers (DOI),Db,EntrezUID,Properties,Year,PubmedLink
XNDis - 284,"Mussolin, C., & Noel, M.-P. (2007). The nonintentional processing of Arabic numbers in children. Journal of Clinical and Experimental Neuropsychology, 29(3), 225–234. http://doi.org/10.1080/13803390600629759",database_search,no,x,,,,,,,The nonintentional processing of Arabic numbers in children,,"Mussolin, Christophe; Noel, Marie-Pascale",Journal of Clinical and Experimental Neuropsychology,,,,10.1080/13803390600629759,,,,2007,
XNDis - 285,"Mussolin, C., & Noel, M.-P. (2008). Automaticity for numerical magnitude of two-digit Arabic numbers in children. Acta Psychologica, 129(2), 264–272. http://doi.org/10.1016/j.actpsy.2008.08.001",database_search,no,x,,,,,,,Automaticity for numerical magnitude of two-digit Arabic numbers in children,,"Mussolin, Christophe; Noel, Marie-Pascale",Acta Psychologica,,,,10.1016/j.actpsy.2008.08.001,,,,2008,
XNDis - 286,"Mussolin, C., Nys, J., Content, A., & Leybaert, J. (2014). Symbolic Number Abilities Predict Later Approximate Number System Acuity in Preschool Children. Plos One, 9(3), e91839. http://doi.org/10.1371/journal.pone.0091839",database_search,no,x,,,,,,,Symbolic Number Abilities Predict Later Approximate Number System Acuity in Preschool Children,,"Mussolin, Christophe; Nys, Julie; Content, Alain; Leybaert, Jacqueline",Plos One,,,,10.1371/journal.pone.0091839,,,,2014,
XNDis - 287,"Newcombe, N. S., Levine, S. C., & Mix, K. S. (2015). Thinking about quantity: the intertwined development of spatial and numerical cognition. Wiley Interdisciplinary Reviews-Cognitive Science, 6(6), 491–505. http://doi.org/10.1002/wcs.1369",database_search,yes,x,,,,,,,Thinking about quantity: the intertwined development of spatial and numerical cognition,,"Newcombe, Nora S.; Levine, Susan C.; Mix, Kelly S.",Wiley Interdisciplinary Reviews-Cognitive Science,,,,10.1002/wcs.1369,,,,2015,
XNDis - 288,"Newcombe, N. S. (2014). The Origins and Development of Magnitude Estimation. Ecological Psychology, 26(1-2), 147–157. http://doi.org/10.1080/10407413.2014.875333 ",database_search,yes,x,,,,,,,The Origins and Development of Magnitude Estimation,,"Newcombe, Nora S.",Ecological Psychology,,,,10.1080/10407413.2014.875333,,,,2014,
XNDis - 289,"Nickerson, R. S. (2010). Mathematical Reasoning: Patterns, Problems, Conjectures, and Proofs.",database_search,no,x,,,,,,,"Mathematical Reasoning: Patterns, Problems, Conjectures, and Proofs",,"Nickerson, R. S.",,,,,,,,,2010,
XNDis - 290,"Nicoladis, E., Pika, S., & Marentette, P. (2010). Are number gestures easier than number words for preschoolers? Cognitive Development, 25(3), 247–261. http://doi.org/10.1016/j.cogdev.2010.04.001",database_search,no,x,,,,,,,Are number gestures easier than number words for preschoolers?,,"Nicoladis, Elena; Pika, Simone; Marentette, Paula",Cognitive Development,,,,10.1016/j.cogdev.2010.04.001,,,,2010,
XNDis - 291,"Nieder, A., & Miller, E. K. (2004). A parieto-frontal network for visual numerical information in the monkey. Proceedings of the National Academy of Sciences of the United States of America, 101(19), 7457–7462. http://doi.org/10.1073/pnas.0402239101",database_search,no,x,,,,,,,A parieto-frontal network for visual numerical information in the monkey,,"Nieder, A.; Miller, E. K.",Proceedings of the National Academy of Sciences of the United States of America,,,,10.1073/pnas.0402239101,,,,2004,
XNDis - 292,"Noel, M.-P., & Rousselle, L. (2011). Developmental changes in the profiles of dyscalculia: an explanation based on a double exact-and-approximate number representation model. Frontiers in Human Neuroscience, 5, 165. http://doi.org/10.3389/fnhum.2011.00165",database_search,no,x,,,,,,,Developmental changes in the profiles of dyscalculia: an explanation based on a double exact-and-approximate number representation model,,"Noel, Marie-Pascale; Rousselle, Laurence",Frontiers in Human Neuroscience,,,,10.3389/fnhum.2011.00165,,,,2011,
XNDis - 293,"Nosworthy, N., Bugden, S., Archibald, L., Evans, B., & Ansari, D. (2013). A Two-Minute Paper-and-Pencil Test of Symbolic and Nonsymbolic Numerical Magnitude Processing Explains Variability in Primary School Children’s Arithmetic Competence. Plos One, 8(7), e67918. http://doi.org/10.1371/journal.pone.0067918",database_search,no,x,,,,,,,A Two-Minute Paper-and-Pencil Test of Symbolic and Nonsymbolic Numerical Magnitude Processing Explains Variability in Primary School Children's Arithmetic Competence,,"Nosworthy, Nadia; Bugden, Stephanie; Archibald, Lisa; Evans, Barrie; Ansari, Daniel",Plos One,,,,10.1371/journal.pone.0067918,,,,2013,
XNDis - 294,"Nuerk, H. C., Kaufmann, L., Zoppoth, S., & Willmes, K. (2004). On the development of the mental number line: More, less, or never holistic with increasing age? Developmental Psychology, 40(6), 1199–1211. http://doi.org/10.1037/0012-1649.40.6.1199",database_search,yes,x,,,,,,,"On the development of the mental number line: More, less, or never holistic with increasing age?",,"Nuerk, H. C.; Kaufmann, L.; Zoppoth, S.; Willmes, K.",Developmental Psychology,,,,10.1037/0012-1649.40.6.1199,,,,2004,
XNDis - 295,"Nunez, R., Doan, D., & Nikoulina, A. (2011). Squeezing, striking, and vocalizing: Is number representation fundamentally spatial? Cognition, 120(2), 225–235. http://doi.org/10.1016/j.cognition.2011.05.001",database_search,yes,x,,,,,,,"Squeezing, striking, and vocalizing: Is number representation fundamentally spatial?",,"Nunez, Rafael; Doan, D.; Nikoulina, Anastasia",Cognition,,,,10.1016/j.cognition.2011.05.001,,,,2011,
XNDis - 296,"Nunez, R. (2009). Numbers and Arithmetic: Neither Hardwired Nor Out There. Biology Theory, 4(1), 68–83. http://doi.org/10.1162/biot.2009.4.1.68  ",database_search,yes,x,,,,,,,Numbers and Arithmetic: Neither Hardwired Nor Out There,,"Nunez, Rafael",Biology Theory,,,,10.1162/biot.2009.4.1.68,,,,2009,
XNDis - 297,"Nunez, R. E. (2011). No Innate Number Line in the Human Brain. Journal of Cross-Cultural Psychology, 42(4), 651–668. http://doi.org/10.1177/0022022111406097",database_search,yes,x,,,,,,,No Innate Number Line in the Human Brain,,"Nunez, Rafael E.",Journal of Cross-Cultural Psychology,,,,10.1177/0022022111406097,,,,2011,
XNDis - 298,"Nys, J., Content, A., & Leybaert, J. (2013). Impact of Language Abilities on Exact and Approximate Number Skills Development: Evidence From Children With Specific Language Impairment. Journal of Speech Language and Hearing Research, 56(3), 956–970. http://doi.org/10.1044/1092-4388(2012/10-0229)",database_search,no,x,,,,,,,Impact of Language Abilities on Exact and Approximate Number Skills Development: Evidence From Children With Specific Language Impairment,,"Nys, Julie; Content, Alain; Leybaert, Jacqueline",Journal of Speech Language and Hearing Research,,,,10.1044/1092-4388(2012/10-0229),,,,2013,
XNDis - 299,"Odic, D., Hock, H., & Halberda, J. (2014). Hysteresis Affects Approximate Number Discrimination in Young Children. Journal of Experimental Psychology-General, 143(1), 255–265. http://doi.org/10.1037/a0030825",database_search,yes,x,,,,,,,Hysteresis Affects Approximate Number Discrimination in Young Children,,"Odic, Darko; Hock, Howard; Halberda, Justin",Journal of Experimental Psychology-General,,,,10.1037/a0030825,,,,2014,
XNDis - 300,"Odic, D., Le Corre, M., & Halberda, J. (2015). Children’s mappings between number words and the approximate number system. Cognition, 138, 102–121. http://doi.org/10.1016/j.cognition.2015.01.008",database_search,no,x,,,,,,,Children's mappings between number words and the approximate number system,,"Odic, Darko; Le Corre, Mathieu; Halberda, Justin",Cognition,,,,10.1016/j.cognition.2015.01.008,,,,2015,
XNDis - 301,"Odic, D., Libertus, M. E., Feigenson, L., & Halberda, J. (2013). Developmental Change in the Acuity of Approximate Number and Area Representations. Developmental Psychology, 49(6), 1103–1112. http://doi.org/10.1037/a0029472",database_search,yes,x,,,,,,,Developmental Change in the Acuity of Approximate Number and Area Representations,,"Odic, Darko; Libertus, Melissa E.; Feigenson, Lisa; Halberda, Justin",Developmental Psychology,,,,10.1037/a0029472,,,,2013,
XNDis - 302,"O’Hearn, K., Hoffman, J. E., & Landau, B. (2011). Small subitizing range in people with Williams syndrome. Visual Cognition, 19(3), 289–312. http://doi.org/10.1080/13506285.2010.535994",database_search,no,x,,,,,,,Small subitizing range in people with Williams syndrome,,"O'Hearn, Kirsten; Hoffman, James E.; Landau, Barbara",Visual Cognition,,,,10.1080/13506285.2010.535994,,,,2011,
XNDis - 303,"O’Hearn, K., & Luna, B. (2009). MATHEMATICAL SKILLS IN WILLIAMS SYNDROME: INSIGHT INTO THE IMPORTANCE OF UNDERLYING REPRESENTATIONS. Developmental Disabilities Research Reviews, 15(1), 11–20. http://doi.org/10.1002/ddrr.47",database_search,no,x,,,,,,,MATHEMATICAL SKILLS IN WILLIAMS SYNDROME: INSIGHT INTO THE IMPORTANCE OF UNDERLYING REPRESENTATIONS,,"O'Hearn, Kirsten; Luna, Beatriz",Developmental Disabilities Research Reviews,,,,10.1002/ddrr.47,,,,2009,
XNDis - 304,"Okamoto, Y. (2010). Children’s Developing Understanding of Number: Mind, Brain, and Culture. (M. Ferrari & L. Vuletic, Eds.).",database_search,yes,x,,,,,,,"Children's Developing Understanding of Number: Mind, Brain, and Culture",,"Okamoto, Yukari",,,,,,,,,2010,
XNDis - 305,"Opfer, J. E., & Martens, M. A. (2012). Learning without representational change: development of numerical estimation in individuals with Williams syndrome. Developmental Science, 15(6), 863–875. http://doi.org/10.1111/j.1467-7687.2012.01187.x",database_search,no,x,,,,,,,Learning without representational change: development of numerical estimation in individuals with Williams syndrome,,"Opfer, John E.; Martens, Marilee A.",Developmental Science,,,,10.1111/j.1467-7687.2012.01187.x,,,,2012,
XNDis - 306,"Papeo, L., & Hochmann, J.-R. (2012). A cross-talk between brain-damage patients and infants on action and language. Neuropsychologia, 50(7), 1222–1234. http://doi.org/10.1016/j.neuropsychologia.2012.03.025",database_search,no,x,,,,,,,A cross-talk between brain-damage patients and infants on action and language,,"Papeo, Liuba; Hochmann, Jean-Remy",Neuropsychologia,,,,10.1016/j.neuropsychologia.2012.03.025,,,,2012,
XNDis - 307,"Park, J., & Brannon, E. M. (2013). Training the Approximate Number System Improves Math Proficiency. Psychological Science, 24(10), 2013–2019. http://doi.org/10.1177/0956797613482944",database_search,no,x,,,,,,,Training the Approximate Number System Improves Math Proficiency,,"Park, Joonkoo; Brannon, Elizabeth M.",Psychological Science,,,,10.1177/0956797613482944,,,,2013,
XNDis - 308,"Park, J., Hebrank, A., Polk, T. A., & Park, D. C. (2012). Neural Dissociation of Number from Letter Recognition and Its Relationship to Parietal Numerical Processing. Journal of Cognitive Neuroscience, 24(1), 39–50.",database_search,no,x,,,,,,,Neural Dissociation of Number from Letter Recognition and Its Relationship to Parietal Numerical Processing,,"Park, Joonkoo; Hebrank, Andrew; Polk, Thad A.; Park, Denise C.",Journal of Cognitive Neuroscience,,,,,,,,2012,
XNDis - 309,"Patro, K., & Krysztofiak, W. (2013). Mental Number Lines. SNARC Effect. Philosophical Aspects. Filozofia Nauki, 21(3), 45–+.",database_search,no,x,,,,,,,Mental Number Lines. SNARC Effect. Philosophical Aspects,,"Patro, Katarzyna; Krysztofiak, Wojciech",Filozofia Nauki,,,,,,,,2013,
XNDis - 310,"Paulsen, D. J., Woldorff, M. G., & Brannon, E. M. (2010). Individual differences in nonverbal number discrimination correlate with event-related potentials and measures of probabilistic reasoning. Neuropsychologia, 48(13), 3687–3695. http://doi.org/10.1016/j.neuropsychologia.2010.08.014",database_search,no,x,,,,,,,Individual differences in nonverbal number discrimination correlate with event-related potentials and measures of probabilistic reasoning,,"Paulsen, David J.; Woldorff, Marty G.; Brannon, Elizabeth M.",Neuropsychologia,,,,10.1016/j.neuropsychologia.2010.08.014,,,,2010,
XNDis - 311,"Pepperberg, I. M. (2006). Ordinality and inferential abilities of a grey parrot (Psittacus erithacus). Journal of Comparative Psychology, 120(3), 205–216. http://doi.org/10.1037/0735-7036.120.3.205",database_search,no,x,,,,,,,Ordinality and inferential abilities of a grey parrot (Psittacus erithacus),,"Pepperberg, Irene M.",Journal of Comparative Psychology,,,,10.1037/0735-7036.120.3.205,,,,2006,
XNDis - 312,"Peterson, D. (2012). Where the Sidewalk Ends: The Limits of Social Constructionism. Journal for the Theory of Social Behaviour, 42(4), 465–+. http://doi.org/10.1111/j.1468-5914.2012.00493.x",database_search,yes,x,,,,,,,Where the Sidewalk Ends: The Limits of Social Constructionism,,"Peterson, David",Journal for the Theory of Social Behaviour,,,,10.1111/j.1468-5914.2012.00493.x,,,,2012,
XNDis - 313,"Petrazzini, M. E. M., Agrillo, C., Piffer, L., & Bisazza, A. (2014). Ontogeny of the capacity to compare discrete quantities in fish. Developmental Psychobiology, 56(3), 529–536. http://doi.org/10.1002/dev.21122",database_search,no,x,,,,,,,Ontogeny of the capacity to compare discrete quantities in fish,,"Petrazzini, Maria Elena Miletto; Agrillo, Christian; Piffer, Laura; Bisazza, Angelo",Developmental Psychobiology,,,,10.1002/dev.21122,,,,2014,
XNDis - 314,"Piazza, M., & Izard, V. (2009). How Humans Count: Numerosity and the Parietal Cortex. Neuroscientist, 15(3), 261–273. http://doi.org/10.1177/1073858409333073",database_search,no,x,,,,,,,How Humans Count: Numerosity and the Parietal Cortex,,"Piazza, Manuela; Izard, Veronique",Neuroscientist,,,,10.1177/1073858409333073,,,,2009,
XNDis - 315,"Piazza, M. (2010). Neurocognitive start-up tools for symbolic number representations. Trends in Cognitive Sciences, 14(12), 542–551. http://doi.org/10.1016/j.tics.2010.09.008",database_search,yes,x,,,,,,,Neurocognitive start-up tools for symbolic number representations,,"Piazza, Manuela",Trends in Cognitive Sciences,,,,10.1016/j.tics.2010.09.008,,,,2010,
XNDis - 316,"Piazza, M. (2011). Neurocognitive Start-Up Tools for Symbolic Number Representations. In S. Dehaene & E. M. Brannon (Eds.), Space, Time and Number in the Brain: Searching for the Foundations of Mathematical Thought: An Attention and Performance Series Volume (pp. 267–285).",database_search,no,x,,,,,,,Neurocognitive Start-Up Tools for Symbolic Number Representations,,"Piazza, Manuela","Space, Time and Number in the Brain: Searching for the Foundations of Mathematical Thought: An Attention and Performance Series Volume",,,,,,,,2011,
XNDis - 317,"Pietroski, P., Lidz, J., Hunter, T., & Halberda, J. (2009). The Meaning of “Most”: Semantics, Numerosity and Psychology. Mind & Language, 24(5), 554–585.",database_search,no,x,,,,,,,"The Meaning of 'Most': Semantics, Numerosity and Psychology",,"Pietroski, Paul; Lidz, Jeffrey; Hunter, Tim; Halberda, Justin",Mind & Language,,,,,,,,2009,
XNDis - 318,"Piffer, L., Agrillo, C., & Hyde, D. C. (2012). Small and large number discrimination in guppies. Animal Cognition, 15(2), 215–221. http://doi.org/10.1007/s10071-011-0447-9",database_search,no,x,,,,,,,Small and large number discrimination in guppies,,"Piffer, Laura; Agrillo, Christian; Hyde, Daniel C.",Animal Cognition,,,,10.1007/s10071-011-0447-9,,,,2012,
XNDis - 319,"Piffer, L., Petrazzini, M. E. M., & Agrillo, C. (2013). Large Number Discrimination in Newborn Fish. Plos One, 8(4), e62466. http://doi.org/10.1371/journal.pone.0062466",database_search,no,x,,,,,,,Large Number Discrimination in Newborn Fish,,"Piffer, Laura; Petrazzini, Maria Elena Miletto; Agrillo, Christian",Plos One,,,,10.1371/journal.pone.0062466,,,,2013,
XNDis - 320,"Pinel, P., & Dehaene, S. (2013). Genetic and environmental contributions to brain activation during calculation. Neuroimage, 81, 306–316. http://doi.org/10.1016/j.neuroimage.2013.04.118",database_search,no,x,,,,,,,Genetic and environmental contributions to brain activation during calculation,,"Pinel, Philippe; Dehaene, Stanislas",Neuroimage,,,,10.1016/j.neuroimage.2013.04.118,,,,2013,
XNDis - 321,"Pinhas, M., Donohue, S. E., Woldorff, M. G., & Brannon, E. M. (2014). Electrophysiological Evidence for the Involvement of the Approximate Number System in Preschoolers’ Processing of Spoken Number Words. Journal of Cognitive Neuroscience, 26(9), 1891–1904. http://doi.org/10.1162/jocn_a_00631",database_search,no,x,,,,,,,Electrophysiological Evidence for the Involvement of the Approximate Number System in Preschoolers' Processing of Spoken Number Words,,"Pinhas, Michal; Donohue, Sarah E.; Woldorff, Marty G.; Brannon, Elizabeth M.",Journal of Cognitive Neuroscience,,,,10.1162/jocn_a_00631,,,,2014,
XNDis - 322,"Pinheiro-Chagas, P., Wood, G., Knops, A., Krinzinger, H., Lonnemann, J., Starling-Alves, I., … Haase, V. G. (2014). In How Many Ways is the Approximate Number System Associated with Exact Calculation? Plos One, 9(11), e111155. http://doi.org/10.1371/journal.pone.0111155",database_search,yes,x,,,,,,,In How Many Ways is the Approximate Number System Associated with Exact Calculation?,,"Pinheiro-Chagas, Pedro; Wood, Guilherme; Knops, Andre; Krinzinger, Helga; Lonnemann, Jan; Starling-Alves, Isabella; Willmes, Klaus; Haase, Vitor Geraldi",Plos One,,,,10.1371/journal.pone.0111155,,,,2014,
XNDis - 323,"Plester, B., Richards, J., Blades, M., & Spencer, C. (2002). Young children’s ability to use aerial photographs as maps. Journal of Environmental Psychology, 22(1-2), 29–47. http://doi.org/10.1006/jevp.2001.0245",database_search,no,x,,,,,,,Young children's ability to use aerial photographs as maps,,"Plester, B.; Richards, J.; Blades, M.; Spencer, C.",Journal of Environmental Psychology,,,,10.1006/jevp.2001.0245,,,,2002,
XNDis - 324,"Posid, T., & Cordes, S. (2015). Verbal Counting Moderates Perceptual Biases Found in Children’s Cardinality Judgments. Journal of Cognition and Development, 16(4), 621–637. http://doi.org/10.1080/15248372.2014.934372",database_search,no,x,,,,,,,Verbal Counting Moderates Perceptual Biases Found in Children's Cardinality Judgments,,"Posid, Tasha; Cordes, Sara",Journal of Cognition and Development,,,,10.1080/15248372.2014.934372,,,,2015,
XNDis - 325,"Posner, M. I., Rothbart, M. K., Farah, M., & Bruer, J. (2001). Special issue: The developing human brain. Developmental Science, 4(3), 253–387.",database_search,no,x,,,,,,,Special issue: The developing human brain,,"Posner, M. I.; Rothbart, M. K.; Farah, M.; Bruer, J.",Developmental Science,,,,,,,,2001,
XNDis - 326,"Rakoczy, H., Cluever, A., Saucke, L., Stoffregen, N., Graebener, A., Migura, J., & Call, J. (2014). Apes are intuitive statisticians. Cognition, 131(1), 60–68. http://doi.org/10.1016/j.cognition.2013.12.011",database_search,no,x,,,,,,,Apes are intuitive statisticians,,"Rakoczy, Hannes; Cluever, Annette; Saucke, Liane; Stoffregen, Nicole; Graebener, Alice; Migura, Judith; Call, Josep",Cognition,,,,10.1016/j.cognition.2013.12.011,,,,2014,
XNDis - 327,"Ramscar, M., Dye, M., Popick, H. M., & O’Donnell-McCarthy, F. (2011). The Enigma of Number: Why Children Find the Meanings of Even Small Number Words Hard to Learn and How We Can Help Them Do Better. Plos One, 6(7), e22501. http://doi.org/10.1371/journal.pone.0022501",database_search,yes,x,,,,,,,The Enigma of Number: Why Children Find the Meanings of Even Small Number Words Hard to Learn and How We Can Help Them Do Better,,"Ramscar, Michael; Dye, Melody; Popick, Hanna Muenke; O'Donnell-McCarthy, Fiona",Plos One,,,,10.1371/journal.pone.0022501,,,,2011,
XNDis - 328,"Raphael, S., Dillenburger, B., & Morgan, M. (2013). Computation of relative numerosity of circular dot textures. Journal of Vision, 13(2), 17. http://doi.org/10.1167/13.2.17",database_search,yes,x,,,,,,,Computation of relative numerosity of circular dot textures,,"Raphael, Sabine; Dillenburger, Barbara; Morgan, Michael",Journal of Vision,,,,10.1167/13.2.17,,,,2013,
XNDis - 329,"Reijnen, E., Wolfe, J. M., & Krummenacher, J. (2013). Coarse guidance by numerosity in visual search. Attention Perception & Psychophysics, 75(1), 16–28. http://doi.org/10.3758/s13414-012-0379-8",database_search,yes,x,,,,,,,Coarse guidance by numerosity in visual search,,"Reijnen, Ester; Wolfe, Jeremy M.; Krummenacher, Joseph",Attention Perception & Psychophysics,,,,10.3758/s13414-012-0379-8,,,,2013,
XNDis - 330,"Renner, E., Price, E. E., & Subiaul, F. (2016). Sequential recall of meaningful and arbitrary sequences by orangutans and human children: Does content matter? Animal Cognition, 19(1), 39–52. http://doi.org/10.1007/s10071-015-0911-z",database_search,no,x,,,,,,,Sequential recall of meaningful and arbitrary sequences by orangutans and human children: Does content matter?,,"Renner, Elizabeth; Price, Elizabeth E.; Subiaul, Francys",Animal Cognition,,,,10.1007/s10071-015-0911-z,,,,2016,
XNDis - 331,"Rousselle, L., Dembour, G., & Noel, M.-P. (2013). Magnitude Representations in Williams Syndrome: Differential Acuity in Time, Space and Number Processing. Plos One, 8(8), e72621. http://doi.org/10.1371/journal.pone.0072621",database_search,no,x,,,,,,,Magnitude comparison in preschoolers: What counts? Influence of perceptual variables,,"Rousselle, L.; Palmers, E.; Noel, M. P.",Journal of Experimental Child Psychology,,,,10.1016/j.jecp.2003.10.005,,,,2004,
XNDis - 332,"Rousselle, L., & Noel, M.-P. (2008). The development of automatic numerosity processing in preschoolers: Evidence for numerosity-perceptual interference. Developmental Psychology, 44(2), 544–560. http://doi.org/10.1037/0012-1649.44.2.544",database_search,no,x,,,,,,,"Magnitude Representations in Williams Syndrome: Differential Acuity in Time, Space and Number Processing",,"Rousselle, Laurence; Dembour, Guy; Noel, Marie-Pascale",Plos One,,,,10.1371/journal.pone.0072621,,,,2013,
XNDis - 333,"Rousselle, L., Palmers, E., & Noel, M. P. (2004). Magnitude comparison in preschoolers: What counts? Influence of perceptual variables. Journal of Experimental Child Psychology, 87(1), 57–84. http://doi.org/10.1016/j.jecp.2003.10.005",database_search,no,x,,,,,,,The development of automatic numerosity processing in preschoolers: Evidence for numerosity-perceptual interference,,"Rousselle, Laurence; Noel, Marie-Pascale",Developmental Psychology,,,,10.1037/0012-1649.44.2.544,,,,2008,
XNDis - 334,"Rubinsten, O., Henik, A., Berger, A., & Shahar-Shalev, S. (2002). The development of internal representations of magnitude and their association with Arabic numerals. Journal of Experimental Child Psychology, 81(1), 74–92. http://doi.org/10.1006/jecp.2001.2645",database_search,no,x,,,,,,,The development of internal representations of magnitude and their association with Arabic numerals,,"Rubinsten, O.; Henik, A.; Berger, A.; Shahar-Shalev, S.",Journal of Experimental Child Psychology,,,,10.1006/jecp.2001.2645,,,,2002,
XNDis - 335,"Rubinsten, O., & Henik, A. (2005). Automatic activation of internal magnitudes: A study of developmental dyscalculia. Neuropsychology, 19(5), 641–648. http://doi.org/10.1037/0894-4105.19.5.641",database_search,no,x,,,,,,,Automatic activation of internal magnitudes: A study of developmental dyscalculia,,"Rubinsten, O.; Henik, A.",Neuropsychology,,,,10.1037/0894-4105.19.5.641,,,,2005,
XNDis - 336,"Rubinsten, O. (2015). Link between cognitive neuroscience and education: the case of clinical assessment of developmental dyscalculia. Frontiers in Human Neuroscience, 9, 304. http://doi.org/10.3389/fnhum.2015.00304 ",database_search,no,x,,,,,,,Link between cognitive neuroscience and education: the case of clinical assessment of developmental dyscalculia,,"Rubinsten, Orly",Frontiers in Human Neuroscience,,,,10.3389/fnhum.2015.00304,,,,2015,
XNDis - 337,"Rugani, R., Regolin, L., & Vallortigara, G. (2011). Summation of large numerousness by newborn chicks. Frontiers in Psychology, 2, 179. http://doi.org/10.3389/fpsyg.2011.00179",database_search,no,x,,,,,,,Summation of large numerousness by newborn chicks,,"Rugani, Rosa; Regolin, Lucia; Vallortigara, Giorgio",Frontiers in Psychology,,,,10.3389/fpsyg.2011.00179,,,,2011,
XNDis - 338,"Ruppli, C. A., Dreiss, A. N., & Roulin, A. (2013). Nestling barn owls assess short-term variation in the amount of vocally competing siblings. Animal Cognition, 16(6), 993–1000. http://doi.org/10.1007/s10071-013-0634-y",database_search,no,x,,,,,,,Nestling barn owls assess short-term variation in the amount of vocally competing siblings,,"Ruppli, Charlene A.; Dreiss, Amelie N.; Roulin, Alexandre",Animal Cognition,,,,10.1007/s10071-013-0634-y,,,,2013,
XNDis - 339,"Ruusuvirta, T., Huotilainen, M., Fellman, V., & Naatanen, R. (2009). Numerical discrimination in newborn infants as revealed by event-related potentials to tone sequences. European Journal of Neuroscience, 30(8), 1620–1624. http://doi.org/10.1111/j.1460-9568.2009.06938.x",database_search,no,x,,,,,,,Numerical discrimination in newborn infants as revealed by event-related potentials to tone sequences,,"Ruusuvirta, Timo; Huotilainen, Minna; Fellman, Vineta; Naatanen, Risto",European Journal of Neuroscience,,,,10.1111/j.1460-9568.2009.06938.x,,,,2009,
XNDis - 340,"Sandrini, M., Rossini, P. M., & Miniussi, C. (2004). The differential involvement of inferior parietal lobule in number comparison: a rTMS study. Neuropsychologia, 42(14), 1902–1909. http://doi.org/10.1016/j.neuropsychologia.2004.05.005",database_search,no,x,,,,,,,The differential involvement of inferior parietal lobule in number comparison: a rTMS study,,"Sandrini, M.; Rossini, P. M.; Miniussi, C.",Neuropsychologia,,,,10.1016/j.neuropsychologia.2004.05.005,,,,2004,
